{
  "id": "p_0006",
  "base": "champion@622ef1b",
  "hypothesis": "S3 winRate=0 的病根不是打不过（kd 2.965，人类换命 3:1），而是破阵后幸存者不推进收割：人类将军（id1）在 100/100 局中平均 9.76s 阵亡 → DisbandAll 破阵，随后幸存 4 人被残余区块热度威胁（SimHeat 受击累积 +0.4/次、衰减 0.005/tick，残留约 20s）锁死在 Cautious（threat 0.5-0.8 持续到 60s），对剩余亡灵不再输出 → 60s 平局（98/100）。降 rfHeatWeight（rawFactor 六权重中最大项 0.5）削弱'战场气氛'对威胁的贡献，抬 rfAllyWeight（身边有友军更安心）放大破阵后幸存抱团的安心感 → 双管齐下让威胁跌破 FullPower 门限 → 幸存者回 FullPower 推进收割残敌 → winRate 抬升。沿用 p_0005'改已验证敏感家族'策略：rawFactor 族已有 M3 区分度实测，推得动。",
  "evidence": [
    "results/baseline/report.json: S3 subScore 0.384 为六场景最低；winRate 0.000、avgDuration 60.0、annihilationRate 0.020（note: 破阵 2.00次/局 首破 8.4s）",
    "results/baseline/s3_formation_break_run0..99.jsonl 聚合: 100 局 98 Draw / 2 Undead / 0 Human；人类将军 id1 100/100 局阵亡 avg 9.76s（触发 DisbandAll 破阵）；人类总亡 202 / 亡灵总亡 599 → kd 2.965",
    "results/baseline/s3_formation_break_run0.jsonl: t=23.3 后无任何 attack 事件；t=23.5 幸存者 id2/id4/id6 threat 0.74/0.74/0.79 持续 Cautious 直到 60s → 破阵后热度威胁锁死 Cautious、不推进收割 → Draw",
    "proposals/history.log: p_0005（rfDistWeight 0.35→0.30）证实 rawFactor 族在套件上推得动（Δ=+0.001 candidate）；M3 differentiation 显示 rfDistWeight 0.20 时 S3 全灭率 2%→94%，rawFactor 权重对 S3 有决定性影响"
  ],
  "changes": [
    { "path": "tuning.rfHeatWeight", "from": 0.5, "to": 0.4, "rationale": "热度是 rawFactor 最大权重，直接锁死破阵后幸存者 threat→Cautious；降 0.1 削弱战场气氛威胁贡献，让幸存者回 FullPower 推进" },
    { "path": "tuning.rfAllyWeight", "from": 0.2, "to": 0.25, "rationale": "抬友军保护权重，破阵后幸存者抱团（4 人相邻）更安心，威胁同步下探，与降 rfHeatWeight 同向破 Cautious 驻留" }
  ],
  "expected": {
    "S3 winRate": "0.000 → >0（部分 Draw 转胜）",
    "S3 subScore": "0.384 → >0.40",
    "S1 胜率": "保持 45-55% sanity 带",
    "S2/S6 胜率": "不降"
  },
  "risk": "rawFactor 双权重同向调低威胁，存在过度激进风险：M3 实测 rfDistWeight 0.20 极端值时 S3 全灭率升至 94%（人类冒进被反杀）。本提案步长保守（heat -0.1 / ally +0.05），但需 propose run 盯 S2/S5 弓手被贴身率、S6 支援热点（依赖 SimHeat）是否退化；rawFactor 六权重 Σ 将由 1.50→1.45，validator 会提示比值变化，意图为'降低战场气氛/放大抱团安心感'的定向削弱，非纯增益。"
}
