{
  "id": "p_0002",
  "base": "champion@622ef1b",
  "hypothesis": "S2 弓手被贴身率恒 0 是因为弓手从未被贴身——想通过降弓手射程制造白嫖场景来验证阵型保护。但此处违反死参数铁律，故意用于测试 harness 拒收路径。",
  "evidence": [
    "results/baseline/report.json: S2 弓手被贴身率 0.000",
    "schemas/factor_registry.example.json: retreatBonusS 已列 deadParams"
  ],
  "changes": [
    { "path": "tuning.retreatBonusS", "from": 0.4, "to": 0.1, "rationale": "故意改死参数测试拒收" }
  ],
  "expected": { "harness拒收": "true" },
  "risk": "无（测试用）"
}
