{
  "id": "p_0001",
  "base": "champion@622ef1b",
  "hypothesis": "S3 破阵检验全灭率偏低说明守方编队耐压不足：守 6 编队面对攻 10 时破阵过于频繁。抬升 l2FormationResistScale 让编队在中等威胁下更硬，减少无谓溃散，但需防'该撤不撤'——S4 战损比是观测点。",
  "evidence": [
    "results/baseline/report.json: S3 破阵 2.00次/局 全灭率 2%",
    "results/baseline/s3_formation_break_run0.jsonl: 编队解散事件集中在 threat 0.5-0.7 区间"
  ],
  "changes": [
    { "path": "tuning.l2FormationResistScale", "from": 0.4, "to": 0.5, "rationale": "抬编队抵抗，中威胁下军令更硬，减少破阵" }
  ],
  "expected": { "S3破阵次数": "2.00次/局 → <1.5次/局", "S4战损比": "不退化 >2%" },
  "risk": "编队过硬可能导致该撤不撤，关注 S4 战损比与 S2 弓手被贴身率"
}
